Title,AD Related,ALG Related,Other Topics,Remarks
A Discriminative Latent Variable Model for Online Clustering,[CLUSTERING],,,
Kernel Mean Estimation and Stein Effect,[CLUSTERING],,,
Demystifying Information-Theoretic Clustering,[CLUSTERING],,,
Covering Number for Efficient Heuristic-based POMDP Planning,,,,
The Coherent Loss Function for Classification,[CLASSIFICATION],,,
Fast Stochastic Alternating Direction Method of Multipliers,,,,
Active Detection via Adaptive Submodularity,,,,
Accelerated Proximal Stochastic Dual Coordinate Ascent for Regularized Loss Minimization,,,,
An Adaptive Accelerated Proximal Gradient Method and its Homotopy Continuation for Sparse Optimization,[SPARSE],,,
Recurrent Convolutional Neural Networks for Scene Labeling,,,[DEEPLEARNING],
A Statistical Perspective on Algorithmic Leveraging,,,,
Thompson Sampling for Complex Online Problems,[ADTECH],,,
Boosting multi-step autoregressive forecasts,,[REGRESSION],,
A Statistical Convergence Perspective of Algorithms for Rank Aggregation from Pairwise Data,[RANKING],,,
Scaling Up Approximate Value Iteration with Options: Better Policies with Fewer Iterations,,,,
Latent Bandits.,[BANDIT],,,
Fast Allocation of Gaussian Process Experts,,,,
Von Mises-Fisher Clustering Models,,[CLUSTERING],,
Convergence rates for persistence diagram estimation in Topological Data Analysis,,,
Buffer k-d Trees: Processing Massive Nearest Neighbor Queries on GPUs,,,[GPGPU]
Austerity in MCMC Land: Cutting the Metropolis-Hastings Budget,,[REGRESSION],
Understanding the Limiting Factors of Topic Modeling via Posterior Contraction Analysis,[RANKING][ADTECH],,
The Inverse Regression Topic Model,,[REGRESSION],
A Consistent Histogram Estimator for Exchangeable Graph Models,,,
Latent Variable Copula Inference for Bundle Pricing from Retail Transaction Data,[ADPRICE],,
Towards Minimax Online Learning with Unknown Time Horizon,,,
Factorized Point Process Intensities: A Spatial Analysis of Professional Basketball,,,
Margins Kernels and Non-linear Smoothed Perceptrons,,,[DEEPLEARNING]
Robust RegBayes: Selectively Incorporating First-Order Logic Domain Knowledge into Bayesian Models,,[CLASSIFICATION],
Learning Theory and Algorithms for revenue optimization in second price auctions with reserve,[ADPRICE],,
Low-density Parity Constraints for Hashing-Based Discrete Integration,,,
Prediction with Limited Advice and Multiarmed Bandits with Paid Observations,[BANDIT],
Bayesian Nonparametric Multilevel Clustering with Group-Level Contexts,,[CLUSTERING]
Large-Margin Metric Learning for Constrained Partitioning Problems,,
Wasserstein Propagation for Semi-Supervised Learning,,[CLUSTERING]
Max-Margin Infinite Hidden Markov Models,,[TIMESERIES]
Efficient Approximation of Cross-Validation for Kernel Methods using Bouligand Influence Function,,
Generalized Exponential Concentration Inequality for Renyi Divergence Estimation,,
Boosting with Online Binary Learners for the Multiclass Bandit Problem,[BANDIT],
Optimal Budget Allocation: Theoretical Guarantee and Efficient Algorithm,[ADTECH][ADPRICE],
Computing Parametric Ranking Models via Rank-Breaking,[RANKING],
Tracking Adversarial Targets,,
Online Bayesian Passive-Aggressive Learning,,[CLASSIFICATION]
Deterministic Policy Gradient Algorithms,,
Modeling Correlated Arrival Events with Latent Semi-Markov Processes,,[TIMESERIES]
Towards scaling up Markov chain Monte Carlo: an adaptive subsampling approach,,[TIMESERIES]
Diagnosis determination: decision trees optimizing simultaneously worst and expected testing cost,,
Condensed Filter Tree for Cost-Sensitive Multi-Label Classification,,[CLASSIFICATION],
On Measure Concentration of Random Maximum A-Posteriori Perturbations,,,
Bias in Natural Actor-Critic Algorithms,[ADTECH],,
Dimension-free Concentration Bounds on Hankel Matrices for Spectral Learning,,,
On Modelling Non-linear Topical Dependencies,,,
A Deep and Tractable Density Estimator,,[CLUSTERING],
(Near) Dimension Independent Risk Bounds for Differentially Private Learning,,,
Quasi-Monte Carlo Feature Maps for Shift-Invariant Kernels,,,
Discriminative Features via Generalized Eigenvectors,,,
Forward-Backward Greedy Algorithms for General Convex Smooth Functions over A Cardinality Constraint,,,
Online Learning in Markov Decision Processes with Changing Cost Sequences,,[TIMESERIES],
Unimodal Bandits: Regret Lower Bounds and Optimal Algorithms,[BANDIT],,
Maximum Mean Discrepancy for Class Ratio Estimation: Convergence Bounds and Kernel Selection,,[CLASSIFICATION],
Asymptotically consistent estimation of the number of change points in highly dependent time series,,[TIMESERIES],
Coordinate-descent for learning orthogonal matrices through Givens rotations,,,
Densifying One Permutation Hashing via Rotation for Fast Near Neighbor Search,,,[PERFORMANCE]
A Divide-and-Conquer Solver for Kernel Support Vector Machines,,[CLASSIFICATION],
Nuclear Norm Minimization via Active Subspace Selection,,[CLUSTERING],
Provable Bounds for Learning Some Deep Representations,,[CLASSIFICATION],
Large-scale Multi-label Learning with Missing Labels,,[CLASSIFICATION],
Learning Graphs with a Few Hubs,,,
Agnostic Bayesian Learning of Ensembles,,,
Towards an optimal stochastic alternating direction method of multipliers,,,
Spherical Hamiltonian Monte Carlo for Constrained Target Distributions,,,
Efficient Continuous-Time Markov Chain Estimation,,,
DeCAF: A Deep Convolutional Activation Feature for Generic Visual Recognition,,,[COMPUTERVISION]
Making the Most of Bag of Words: Sentence Regularization with Alternating Direction Method of Multipliers,[RANKING],,
Narrowing the Gap: Random Forests In Theory and In Practice,,[CLASSIFICATION],
Coherent Matrix Completion,,,
Admixture of Poisson MRFs: A Topic Model with Word Dependencies,[RANKING],,
True Online TD(lambda),[ADTECH],,
Memory Efficient Kernel Approximation,,,[PERFORMANCE]
Learning Sum-Product Networks with Direct and Indirect Variable Interactions,,
Hamiltonian Monte Carlo Without Detailed Balance,,
Filtering with Abstract Particles,[RANKING],
Stochastic Dual Coordinate Ascent with Alternating Direction Method of Multipliers,,
Deep Supervised and Convolutional Generative Stochastic Network for Protein Secondary Structure Prediction,,
An Efficient Approach for Assessing Hyperparameter Importance,,
An Information Geometry of Statistical Manifold Learning,,
Relative Upper Confidence Bound for the K-Armed Dueling Bandit Problem,[BANDIT],
Compact Random Feature Maps,,[CLUSTERING]
Concentration in unbounded metric spaces and algorithmic stability,,
Heavy-tailed regression with a generalized median-of-means,,[REGRESSION]
Spectral Bandits for Smooth Graph Functions,[BANDIT],
Robust Principal Component Analysis with Complex Noise,,[CLUSTERING]
Scalable Semidefinite Relaxation for Maximum A Posterior Estimation,,
Square Deal: Lower Bounds and Improved Relaxations for Tensor Recovery,,
Automated inference of point of view from user interactions in collective intelligence venues,[ADTECH][UX],
Rank-One Matrix Pursuit for Matrix Completion,,
Near-Optimal Joint Object Matching via Convex Relaxation,,
Convex Total Least Squares,,
On p-norm Path Following in Multiple Kernel Learning for Non-linear Feature Selection,,[FEATURESELECTION]
Gradient Hard Thresholding Pursuit for Sparsity-Constrained Optimization,,[SPARSE]
A Unified Framework for Consistency of Regularized Loss Minimizers,,
Geodesic Distance Function Learning via Heat Flow on Vector Fields,,
Near-Optimally Teaching the Crowd to Classify,,
On the convergence of no-regret learning in selfish routing,,
Improving offline evaluation of contextual bandit algorithms via bootstrapping techniques,[BANDIT],
Scaling Up Robust MDPs using Function Approximation,,
Marginal Structured SVM with Hidden Variables,,[CLASSIFCATION]
Linear and Parallel Learning of Markov Random Fields,,[TIMESERIES]
Pitfalls in the use of Parallel Inference for the Dirichlet Process,,[TIMESERIES]
Optimal PAC Multiple Arm Identification with Applications to Crowdsourcing,,
Deep Generative Stochastic Networks Trainable by Backprop,,
A Highly Scalable Parallel Algorithm for Isotropic Total Variation Models,,
Statistical-Computational Phase Transitions in Planted Models: The High-Dimensional Setting,,
Gaussian Process Optimization with Mutual Information,,
Aggregating Ordinal Labels from Crowds by Minimax Conditional Entropy,,
Exchangeable Variable Models,,
Clustering in the Presence of Background Noise,,[CLUSTERING]
Safe Screening with Variational Inequalities and Its Application to Lasso,,
Learning the Consistent Behavior of Common Users for Target Node Prediction across Social Networks,[UX],
Signal recovery from Pooling Representations,[ADTECH],
PAC-inspired Option Discovery in Lifelong Reinforcement Learning,,
Multi-label Classification via Feature-aware Implicit Label Space Encoding,,[CLASSIFICATION]
Scalable Gaussian Process Structured Prediction for Grid Factor Graph Applications,,
Anomaly Ranking as Supervised Bipartite Ranking,,
Hierarchical Quasi-Clustering Methods for Asymmetric Networks,,[CLUSTERING]
Rectangular Tiling Process,,
Two-Stage Metric Learning,,
Stochastic Inference for Scalable Probabilistic Modeling of Binary Matrices,,,
Elementary Estimators for High-Dimensional Linear Regression,,[REGRESSION],
Elementary Estimators for Sparse Covariance Matrices and other Structured Moments,,,
Graph-based Semi-supervised Learning: Realizing Pointwise Smoothness Probabilistically,,[CLUSTERING],
Bayesian Max-margin Multi-Task Learning with Data Augmentation,,,
Sparse Reinforcement Learning via Convex Optimization,,,
Gaussian Process Classification and Active Learning with Multiple Annotators,,[CLASSIFICATION],
Structured Prediction of Network Response,,,
An Analysis of State-Relevance Weights and Sampling Distributions on L1-Regularized Approximate Linear Programming Approximation Accuracy,,,
Optimization Equivalence of Divergences Improves Neighbor Embedding,,,
An Asynchronous Parallel Stochastic Coordinate Descent Algorithm,,,
Consistency of Causal Inference under the Additive Noise Model,,,
Globally Convergent Parallel MAP LP Relaxation Solver using the Frank-Wolfe Algorithm,,,
Linear Programming for Large-Scale Markov Decision Problems,,,
Linear Time Solver for Primal SVM,,[CLASSIFICATION],
Memory (and Time) Efficient Sequential Monte Carlo,,,[PERFORMANCE]
Scaling SVM and Least Absolute Deviations via Exact Data Reduction,,[CLASSIFICATION]
Latent Semantic Representation Learning for Scene Classification,,[CLASSIFICATION]
Least Squares Revisited: Scalable Approaches for Multi-class Prediction,,
Local algorithms for interactive clustering,,[CLUSTERING]
Model-Based Relational RL When Object Existence is Partially Observable,,
A new Q(lambda) with interim forward view and Monte Carlo equivalence,,
On Robustness and Regularization of Structural Support Vector Machines,,[CLASSIFICATION]
Guess-Averse Loss Functions For Cost-Sensitive Multiclass Boosting,,
Multimodal Neural Language Models,,
Fast large-scale optimization by unifying stochastic gradient and quasi-Newton methods,,
Alternating Minimization for Mixed Linear Regression,,
Stochastic Neighbor Compression,,
Robust Learning under Uncertain Test Distributions: Relating Covariate Shift to Model Misspecification,,
Nonparametric Estimation of Multi-View Latent Variable Models,,
Structured Generative Models of Natural Source Code,,
A Single-Pass Algorithm for Efficiently Recovering Sparse Cluster Centers of High-dimensional Data,,[CLUSTERING]
Statistical analysis of stochastic gradient methods for generalized linear models,,[REGRESSION]
Coding for Random Projections,,
Fast Computation of Wasserstein Barycenters,,
Global graph kernels using geometric embeddings,,
Topic Modeling using Topics from Many Domains Lifelong Learning and Big Data,[ADTECH][CTR][CV][RANKING],
K-means recovers ICA filters when independent components are sparse,,[CLUSTERING]
Learning Mixtures of Linear Classifiers,,[CLASSIFICATION]
The Falling Factorial Basis and Its Statistical Applications,,
Nonmyopic epsilon -Bayes-Optimal Active Learning of Gaussian Processes,,[CLASSIFICATION]
A Unifying View of Representer Theorems,,
Online Clustering of Bandits,[BANDIT],
Cold-start Active Learning with Robust Ordinal Matrix Factorization,,
Multivariate Maximal Correlation Analysis,,
Efficient Label Propagation,,[CLASSIFICATION]
Estimating Diffusion Network Structures: Recovery Conditions Sample Complexity &amp; Soft-thresholding Algorithm,,
Coupled Group Lasso for Web-Scale CTR Prediction in Display Advertising,,
Putting MRFs on a Tensor Train,,,
Efficient Algorithms for Robust One-bit Compressive Sensing,,,
Learning Complex Neural Network Policies with Trajectory Optimization,,,[DEEPLEARNING]
Composite Quantization for Approximate Nearest Neighbor Search,,,[PERFORMANCE]
Local Ordinal Embedding,,,
Reducing Dueling Bandits to Cardinal Bandits,[BANDIT],,
Large-margin Weakly Supervised Dimensionality Reduction,,[CLUSTERING],
Joint Inference of Multiple Label Types in Large Networks,,,
Hard-Margin Active Linear Regression,,[REGRESSION],
Maximum Margin Multiclass Nearest Neighbors,,[CLASSIFICATION],
Combinatorial Partial Monitoring Game with Linear Feedback and Its Applications,,,
Sparse meta-Gaussian information bottleneck,,[SPARSE],
Nonparametric Estimation of Renyi Divergence and Friends,,,
Robust Inverse Covariance Estimation under Noisy Measurements,,,
Bayesian Optimization with Inequality Constraints,,,
Circulant Binary Embedding,,,
Multiple Testing under Dependence via Semiparametric Graphical Models,,
Making Fisher Discriminant Analysis Scalable,,
Hierarchical Dirichlet Scaling Process,,
Approximation Analysis of Stochastic Gradient Langevin Dynamics by using Fokker-Planck Equation and Ito Process,,
A PAC-Bayesian bound for Lifelong Learning,,
Communication-Efficient Distributed Optimization using an Approximate Newton-type Method,,
Concept Drift Detection Through Resampling,,
Anti-differentiating approximation algorithms:A case study with min-cuts spectral and flow,,[CLASSIFICATION]
A Bayesian Wilcoxon signed-rank test based on the Dirichlet process,,
Min-Max Problems on Factor Graphs,,
Distributed Stochastic Gradient MCMC,,[REGRESSION]
Nearest Neighbors Using Compact Sparse Codes,,[CLASSIFICATION]
Optimal Mean Robust Principal Component Analysis,,[CLUSTERING]
Preference-Based Rank Elicitation using Statistical Models: The Case of Mallows,,
Hierarchical Conditional Random Fields for Outlier Detection: An Application to Detecting Epileptogenic Cortical Malformations,,
A Physics-Based Model Prior for Object-Oriented MDPs,,
Outlier Path: A Homotopy Algorithm for Robust SVM,,[CLASSIFICATION],
Ensemble-Based Tracking: Aggregating Crowdsourced Structured Time Series Data,,,
Latent Confusion Analysis by Normalized Gamma Construction,,,
Finito: A faster permutable incremental gradient method for big data problems,,,[BIGDATA]
Ensemble Methods for Structured Prediction,,,
Standardized Mutual Information for Clustering Comparisons: One Step Further in Adjustment for Chance,,[CLUSTERING],
Preserving Modes and Messages via Diverse Particle Selection,,,
Nonlinear Information-Theoretic Compressive Measurement Design,,,
Dual Query: Practical Private Query Release for High Dimensional Data,,,
Deep Boosting,,,
Distributed Representations of Sentences and Documents,[ADTECH][RANKING],,
Understanding Protein Dynamics with L1-Regularized Reversible Hidden Markov Models,,,
Online Multi-Task Learning for Policy Gradient Methods,,,
Affinity Weighted Embedding,,,
Learning the Parameters of Determinantal Point Process Kernels,,,
Discrete Chebyshev Classifiers,,,
Deep AutoRegressive Networks,,[REGRESSION],
A Convergence Rate Analysis for LogitBoost MART and Their Variant,,,
Inferning with High Girth Graphical Models,,,
Learning Latent Variable Gaussian Graphical Models,,[CLUSTERING],
Stochastic Backpropagation and Approximate Inference in Deep Generative Models,,,
One Practical Algorithm for Both Stochastic and Adversarial Bandits,[BANDIT],,
Robust and Efficient Kernel Hyperparameter Paths with Guarantees,,,
Active Transfer Learning under Model Shift,,,
Approximate Policy Iteration Schemes: A Comparison,,,
Stable and Efficient Representation Learning with Nonnegativity Constraints,,,
Sample Efficient Reinforcement Learning with Gaussian Processes,,,
Memory and Computation Efficient PCA via Very Sparse Random Projections,,,[PERFORMANCE]
Time-Regularized Interrupting Options (TRIO),,,
Randomized Nonlinear Component Analysis,,[CLUSTERING],
High Order Regularization for Semi-Supervised Learning of Structured Output Problems,,[CLASSIFICATION],
Transductive Learning with Multi-class Volume Approximation,,[CLASSIFICATION],
Methods of Moments for Learning Stochastic Languages: Unified Presentation and Empirical Comparison,,
Effective Bayesian Modeling of Groups of Related Count Time Series,,[TIMESERIES]
Variational Inference for Sequential Distance Dependent Chinese Restaurant Process,,
Discovering Latent Network Structure in Point Process Data,,
A Kernel Independence Test for Random Processes,,
Learning to Disentangle Factors of Variation with Manifold Interaction,,
Learning Modular Structures from Network Data and Node Variables,,
Probabilistic Partial Canonical Correlation Analysis,,[RECOMMENDATION]
Skip Context Tree Switching,,
Lower Bounds for the Gibbs Sampler over Mixtures of Gaussians,,
Marginalized Denoising Auto-encoders for Nonlinear Representations,,
Gaussian Processes for Bayesian Estimation in Ordinary Differential Equations,,
Fast Multi-stage Submodular Maximization,,
Programming by Feedback,,
Probabilistic Matrix Factorization with Non-random Missing Data,,
Pursuit-Evasion Without Regret with an Application to Trading,,
The f-Adjusted Graph Laplacian: a Diagonal Modification with a Geometric Interpretation,,
Riemannian Pursuit for Big Matrix Recovery,,
Dynamic Programming Boosting for Discriminative Macro-Action Discovery,,
Online Stochastic Optimization under Correlated Bandit Feedback,,
Weighted Graph Clustering with Non-Uniform Uncertainties,,
GeNGA: A Generalization of Natural Gradient Ascent with Positive and Negative Convergence Results,,
A Bayesian Framework for Online Classifier Ensemble,[ADTECH],[CLASSIFICATION]
Adaptivity and Optimism: An Improved Exponentiated Gradient Algorithm,,
Gaussian Approximation of Collective Graphical Models,,
On learning to localize objects with minimal supervision,,
Multiresolution Matrix Factorization,,
Learnability of the Superset Label Learning Problem,,[CLASSIFICATION]
Taming the Monster: A Fast and Simple Algorithm for Contextual Bandits,[BANDIT],
Structured Recurrent Temporal Restricted Boltzmann Machines,,
Scalable and Robust Bayesian Inference via the Median Posterior,,
Kernel Adaptive Metropolis-Hastings,,
Input Warping for Bayesian Optimization of Non-Stationary Functions,,,
Stochastic Gradient Hamiltonian Monte Carlo,,,
A Deep Semi-NMF Model for Learning Hidden Representations,,,
Asynchronous Distributed ADMM for Consensus Optimization,,,
Spectral Regularization for Max-Margin Sequence Tagging,,,
Learning by Stretching Deep Networks,,,[DEEPLEARNING]
Nonnegative Sparse PCA with Provable Guarantees,,[CLUSTERING],
Active Learning of Parameterized Skills,,[CLASSIFICATION],
Learning Ordered Representations with Nested Dropout,,,
Learning the Irreducible Representations of Commutative Lie Groups,,,[DEEPLEARNING]
Towards End-To-End Speech Recognition with Recurrent Neural Networks,,,
Multi-period Trading Prediction Markets with Connections to Machine Learning,[CTR][CV],,
Efficient Gradient-Based Inference through Transformations between Bayes Nets and Neural Nets,,,
Neural Variational Inference and Learning in Belief Networks,,,
Scalable Bayesian Low-Rank Decomposition of Incomplete Multiway Tensors,,,
Beta Diffusion Trees,,,
Learning Character-level Representations for Part-of-Speech Tagging,,,
Saddle Points and Accelerated Perceptron Algorithms,,,
Robust Distance Metric Learning via Simultaneous L1-Norm Minimization and Maximization,,,
Learning from Contagion (Without Timestamps),,,
Stochastic Variational Inference for Bayesian Time Series Models,,,
A Clockwork RNN,,,[DEEPLEARNING]
Estimating Latent-Variable Graphical Models using Moments and Likelihoods,,,
Universal Matrix Completion,,,
Finding Dense Subgraphs via Low-Rank Bilinear Optimization,,,
Compositional Morphology for Word Representations and Language Modelling,,,
Learning Polynomials with Neural Networks,,,
Exponential Family Matrix Completion under Structural Constraints,,,
Sample-based approximate regularization,,,
A Compilation Target for Probabilistic Programming Languages,,,
Adaptive Monte Carlo via Bandit Allocation,,,
Efficient Dimensionality Reduction for High-Dimensional Network Estimation,,,
Deterministic Anytime Inference for Stochastic Continuous-Time Markov Processes,,
Doubly Stochastic Variational Bayes for non-Conjugate Inference,,
Efficient Learning of Mahalanobis Metrics for Ranking,,
GEV-Canonical Regression for Accurate Binary Class Probability Estimation when One Class is Rare,,
A reversible infinite HMM using normalised random measures,,[TIMESERIES]
Structured Low-Rank Matrix Factorization: Optimality Algorithm and Applications to Image Processing,,
Influence Function Learning in Information Diffusion Networks,,
